{
  "schema_version": "1.0",
  "episode_id": "episode_demo_r1",
  "project_id": "project_demo",
  "run_id": "run_demo_1",
  "round_id": "r1",
  "problem_class": "python_api_optimisation",
  "action_intents": ["improve_type_correctness"],
  "artifact_description": "FastAPI authentication handler",
  "recorded_at": "2026-03-22T11:00:00Z",
  "reflection": {
    "worth_pursuing": "yes",
    "reasoning": "Return annotations reduced pyright noise immediately."
  },
  "provenance": {
    "source": "round_reflection",
    "detail": "captured at end of round 1"
  }
}
